{
  "meta": {
    "name": "Isekai/Fantasy Filters",
    "version": "1.0",
    "description": "Additional filters for isekai and fantasy light novels. Heavy on RPG terminology and fantasy concepts.",
    "extends": "base"
  },
  "katakana_common_words": {
    "rpg_mechanics": [
      "ヒットポイント", "マジックポイント", "エクスペリエンス", "ゴールド",
      "インベントリ", "エクイップ", "スロット", "クールタイム", "キャスト",
      "クリティカル", "ミス", "ドッジ", "ブロック", "パリィ", "カウンター",
      "コンボ", "チェイン", "オーバーキル", "オーバードライブ"
    ],
    "fantasy_races": [
      "エルフ", "ドワーフ", "オーク", "トロール", "オーガ", "コボルト",
      "リザードマン", "ハーフリング", "ノーム", "フェアリー", "ピクシー",
      "ヴァンパイア", "ウェアウルフ", "サキュバス", "インキュバス",
      "デーモン", "エンジェル", "スピリット", "ゴースト", "スケルトン"
    ],
    "magic_elements": [
      "ファイア", "アイス", "サンダー", "ウィンド", "アース", "ウォーター",
      "ライト", "ダーク", "ホーリー", "カース", "ポイズン", "パラライズ",
      "ヒール", "リジェネ", "バリア", "シールド", "テレポート", "サモン"
    ],
    "equipment_items": [
      "ソード", "シールド", "アーマー", "ヘルメット", "ガントレット",
      "ブーツ", "マント", "ローブ", "スタッフ", "ワンド", "グリモワール",
      "ポーション", "エリクサー", "アンチドート", "スクロール", "オーブ",
      "アミュレット", "タリスマン", "リング", "ブレスレット"
    ],
    "locations_structures": [
      "ダンジョン", "ラビリンス", "タワー", "キャッスル", "フォートレス",
      "ヴィレッジ", "タウン", "シティ", "キングダム", "エンパイア",
      "ギルドホール", "テンプル", "シュライン", "アカデミー", "アリーナ"
    ]
  },
  "kanji_stylistic_ruby": {
    "fantasy_concepts": [
      "竜", "魔", "聖", "邪", "闘", "戦", "勇", "賢", "魔王", "勇者",
      "騎士", "魔導", "召喚", "転生", "異世界", "迷宮", "冒険"
    ],
    "power_abilities": [
      "覚醒", "解放", "進化", "強化", "超越", "究極", "最強", "無敵",
      "不死", "永遠", "無限", "絶対", "神聖", "暗黒"
    ]
  },
  "common_terms": {
    "isekai_specific": [
      "転生", "召喚", "異世界", "現代", "前世", "来世", "神様", "女神",
      "チート", "無双", "俺TUEE", "ハーレム", "従魔", "使い魔", "眷属"
    ]
  },
  "confidence_modifiers": {
    "boosts": {
      "fantasy_name_pattern": 0.15
    },
    "penalties": {
      "common_fantasy_term": -0.30
    }
  }
}
