{
  "meta": {
    "name": "School Life/Romance Filters",
    "version": "1.0",
    "description": "Additional filters for school life, romance, and slice-of-life light novels.",
    "extends": "base"
  },
  "katakana_common_words": {
    "school_activities": [
      "クラブ", "サークル", "ゼミ", "コンパ", "オリエンテーション",
      "ホームルーム", "ガイダンス", "カウンセリング", "インターン",
      "ボランティア", "フィールドワーク", "プレゼン", "ディベート"
    ],
    "school_events": [
      "フェスティバル", "コンテスト", "コンクール", "マラソン", "リレー",
      "バザー", "ダンスパーティー", "プロム", "グラジュエーション"
    ],
    "relationship_terms": [
      "カップル", "パートナー", "ボーイフレンド", "ガールフレンド",
      "デート", "プロポーズ", "キス", "ハグ", "スキンシップ",
      "ラブラブ", "イチャイチャ", "ツンデレ", "ヤンデレ", "クーデレ"
    ],
    "social_media": [
      "インスタ", "ツイッター", "フェイスブック", "ユーチューブ",
      "ティックトック", "フォロー", "フォロワー", "いいね", "シェア",
      "ハッシュタグ", "ストーリー", "リール", "ライブ配信"
    ],
    "fashion_beauty": [
      "メイクアップ", "スキンケア", "ヘアケア", "ネイル", "エステ",
      "ダイエット", "フィットネス", "ヨガ", "ピラティス",
      "コーデ", "コスメ", "ブランド", "トレンド", "ファッション"
    ]
  },
  "common_terms": {
    "school_hierarchy": [
      "一年生", "二年生", "三年生", "新入生", "在校生", "卒業生",
      "先輩", "後輩", "同級生", "同期", "級友", "幼馴染",
      "転校生", "留年生", "飛び級", "特待生", "推薦生"
    ],
    "school_positions": [
      "生徒会", "会長", "副会長", "書記", "会計", "委員長",
      "風紀委員", "図書委員", "保健委員", "美化委員", "放送委員",
      "部長", "副部長", "マネージャー", "エース", "レギュラー"
    ],
    "romance_expressions": [
      "告白", "両想", "片想", "振られ", "付き合", "別れ",
      "嫉妬", "独占欲", "束縛", "浮気", "二股", "三角関係",
      "初恋", "初キス", "初デート", "記念日"
    ]
  },
  "confidence_modifiers": {
    "boosts": {
      "student_name_pattern": 0.10
    },
    "penalties": {
      "common_school_term": -0.25
    }
  }
}
